<?xml version="1.0" encoding="UTF-8" ?>
<rules xmlns:xsi="http://www.w3.org/2001/XMLSchema-instance"
       xmlns="http://nambm.io/crawling-rule"
       xsi:schemaLocation="http://nambm.io/crawling-rule ../xsd/crawling.xsd">

                  Vinabook</siteName>
        <basedUrl>https://www.vinabook.com/


                      Sách vừa phát hành trong tuần</topicName>
                       newArr</topicCode>
                <url incrementParam="?page={i}" to="5">https://www.vinabook.com/sach-moi-phat-hanh</url>
                <fragmentXpath>//table[contains(@class, "template-products")]
            </topic>

                           Kho Sách Giảm Giá</topicName>
                <topicCode>sale</topicCode>
                <url incrementParam="?page={i}" to="5">https://www.vinabook.com/kho-sach-giam-gia</url>
                <fragmentXpath>//table[contains(@class, "template-products")]</fragmentXpath>
            </topic>
        </topics>
        <collectionXpath>*//td[contains(@class, "compact")]</collectionXpath>
        <item>
            <detailXpath detailName="id" prefix="VNB_" isRequired="true">/@value</detailXpath>
            *//a[contains(@class, "product-title")]/text()</detailXpath>
    </rule>
</rules>